{
  "fixture_id": "scp-173-pass-001",
  "kind": "positive",
  "checkpoint": "post_writer",
  "input": {
    "scp_id": "SCP-173",
    "title": "SCP-173 - 조각상",
    "scenes": [
      {
        "scene_num": 1,
        "act_id": "act_hook",
        "narration": "눈을 깜빡이는 순간, 그것은 이미 당신 뒤에 서 있습니다.",
        "fact_tags": [{"key": "class", "content": "유클리드"}],
        "mood": "tension",
        "entity_visible": true,
        "location": "특수 격리 구역",
        "characters_present": ["D급 인원"],
        "color_palette": "dark_concrete",
        "atmosphere": "suffocating"
      },
      {
        "scene_num": 2,
        "act_id": "act_lore",
        "narration": "재단 데이터베이스에 따르면 SCP-173은 1993년 처음 발견되었습니다.",
        "fact_tags": [{"key": "discovered", "content": "1993"}],
        "mood": "investigative",
        "entity_visible": false,
        "location": "재단 기록 보관소",
        "characters_present": ["연구원"],
        "color_palette": "muted_gray",
        "atmosphere": "clinical"
      },
      {
        "scene_num": 3,
        "act_id": "act_threat",
        "narration": "격리실 내 시선 접촉이 끊기면 SCP-173은 초인적 속도로 이동합니다.",
        "fact_tags": [{"key": "ability", "content": "시선 차단 시 이동"}],
        "mood": "dread",
        "entity_visible": true,
        "location": "격리실 내부",
        "characters_present": ["D급 인원", "감시 요원"],
        "color_palette": "blood_red_tint",
        "atmosphere": "hostile"
      },
      {
        "scene_num": 4,
        "act_id": "act_incident",
        "narration": "2001년 격리 실패 사건에서 14명의 인원이 사망했습니다.",
        "fact_tags": [{"key": "incident", "content": "격리 실패 2001"}],
        "mood": "horror",
        "entity_visible": false,
        "location": "구역 19",
        "characters_present": ["희생자들"],
        "color_palette": "monochrome",
        "atmosphere": "desolate"
      },
      {
        "scene_num": 5,
        "act_id": "act_procedure",
        "narration": "현재 격리 프로토콜은 최소 3명의 인원이 동시에 시선을 유지하도록 요구합니다.",
        "fact_tags": [{"key": "protocol", "content": "3인 시선 유지"}],
        "mood": "procedural",
        "entity_visible": true,
        "location": "격리 구역 입구",
        "characters_present": ["격리 팀"],
        "color_palette": "safety_yellow",
        "atmosphere": "tense_routine"
      },
      {
        "scene_num": 6,
        "act_id": "act_mystery",
        "narration": "SCP-173의 기원은 불명입니다. 발견 당시 창고에 단독으로 있었습니다.",
        "fact_tags": [{"key": "origin", "content": "불명"}],
        "mood": "mysterious",
        "entity_visible": false,
        "location": "최초 발견 창고",
        "characters_present": ["발견자"],
        "color_palette": "dusty_sepia",
        "atmosphere": "eerie"
      },
      {
        "scene_num": 7,
        "act_id": "act_escalation",
        "narration": "당신도 지금 이 순간, 화면에서 눈을 떼지 않고 있지 않습니까?",
        "fact_tags": [],
        "mood": "fourth_wall",
        "entity_visible": false,
        "location": "시청자 공간",
        "characters_present": ["시청자"],
        "color_palette": "screen_glow_blue",
        "atmosphere": "immersive"
      },
      {
        "scene_num": 8,
        "act_id": "act_close",
        "narration": "재단은 SCP-173을 안전하게 봉인했다고 말합니다. 하지만 과연 그것이 사실일까요?",
        "fact_tags": [{"key": "status", "content": "격리 중"}],
        "mood": "ominous",
        "entity_visible": false,
        "location": "재단 본부",
        "characters_present": ["재단 대변인"],
        "color_palette": "cold_white",
        "atmosphere": "unsettling"
      }
    ],
    "metadata": {
      "language": "ko",
      "scene_count": 8,
      "writer_model": "deepseek-v4-flash",
      "writer_provider": "deepseek",
      "prompt_template": "v1-scenario-writer",
      "format_guide_template": "v1-format-guide",
      "forbidden_terms_version": "v1"
    },
    "source_version": "v1-llm-writer"
  },
  "expected_verdict": "pass",
  "category": "known_pass",
  "notes": "Strong hook, emotional variation, 4th-wall break — production-quality SCP-173 scenario"
}
